{
  "$schema": "https://json-schema.org/draft/2020-12/schema",
  "$id": "https://chessmentor.local/schemas/course.schema.json",
  "title": "Chess Mentor Course",
  "type": "object",
  "additionalProperties": false,
  "required": [
    "schemaVersion",
    "id",
    "title",
    "slug",
    "summary",
    "targetRating",
    "modules"
  ],
  "properties": {
    "schemaVersion": {
      "type": "string",
      "const": "1.0.0"
    },
    "id": {
      "type": "string",
      "pattern": "^[a-z0-9][a-z0-9-]*$"
    },
    "title": {
      "type": "string",
      "minLength": 3
    },
    "slug": {
      "type": "string",
      "pattern": "^[a-z0-9][a-z0-9-]*$"
    },
    "summary": {
      "type": "string",
      "minLength": 10
    },
    "targetRating": {
      "$ref": "#/$defs/ratingBand"
    },
    "estimatedHours": {
      "type": "number",
      "minimum": 0
    },
    "tags": {
      "type": "array",
      "items": {
        "type": "string"
      },
      "uniqueItems": true
    },
    "modules": {
      "type": "array",
      "minItems": 1,
      "items": {
        "type": "object",
        "additionalProperties": false,
        "required": [
          "id",
          "title",
          "summary",
          "lessonRefs"
        ],
        "properties": {
          "id": {
            "type": "string",
            "pattern": "^[a-z0-9][a-z0-9-]*$"
          },
          "title": {
            "type": "string"
          },
          "summary": {
            "type": "string"
          },
          "lessonRefs": {
            "type": "array",
            "items": {
              "type": "string"
            }
          },
          "assessmentRefs": {
            "type": "array",
            "items": {
              "type": "string"
            }
          }
        }
      }
    },
    "assessment": {
      "type": "object",
      "additionalProperties": false,
      "properties": {
        "entryCriteria": {
          "type": "array",
          "items": {
            "type": "string"
          }
        },
        "completionCriteria": {
          "type": "array",
          "items": {
            "type": "string"
          }
        }
      }
    }
  },
  "$defs": {
    "ratingBand": {
      "type": "object",
      "additionalProperties": false,
      "required": [
        "min",
        "max"
      ],
      "properties": {
        "min": {
          "type": "integer",
          "minimum": 0
        },
        "max": {
          "type": "integer",
          "minimum": 0
        }
      }
    }
  }
}
